{
    "$schema": "http://json-schema.org/draft-07/schema#",
    "title": "OpenTestApi Json Schema Version 1.0",
    "type": "object",
    "properties": {
        "testapi": {
            "type": "string",
            "description": "Specifies the TestAPI version."
        },
        "id": {
            "type": "string",
            "description": "Identifier of the test case."
        },
        "description": {
            "type": "string",
            "description": "The informal description of the test case."
        },
        "injections": {
            "type": "array",
            "items": {
                "type": "object",
                "properties": {
                    "injectid": {
                        "type": "string"
                    },
                    "service": {},
                    "checks": {
                        "type": "array",
                        "items": {
                            "type": "string"
                        }
                    },
                    "cron": {
                        "type": "array",
                        "items": {
                            "type": "string"
                        }
                    },
                    "timetolive": {
                        "type": "string",
                        "pattern": "^\\d+(s|m|h|d){0,1}$"
                    },
                    "sourcefile": {
                        "type": "string"
                    },
                    "replacements": {},
                    "active": {
                        "type": "boolean"
                    }
                },
                "additionalProperties": false,
                "required": [
                    "injectid",
                    "service",
                    "checks",
                    "sourcefile"
                ]
            },
            "minItems": 1,
            "uniqueItems": true
        },
        "checks": {
            "type": "array",
            "items": {
                "type": "object",
                "properties": {
                    "checkid": {
                        "type": "string"
                    },
                    "service": {},
                    "validations": {},
                    "maxwaittime": {
                        "type": "string",
                        "pattern": "^\\d+(s|m|h|d){0,1}$"
                    },
                    "active": {
                        "type": "boolean"
                    }
                },
                "required": [
                    "checkid",
                    "service",
                    "validations"
                ]
            },            
            "uniqueItems": true
        },
        "active": {
            "type": "boolean"
        },
        "labels": {
            "type": "array",
            "items": {
                "type": "string"
            }
        },
        "additionalProperties": false
    },
    "required": [
        "testapi",
        "id",
        "description"
    ]
}