{
    "id" : "kafka_002",
    "testapi": "1.0",
    "active" : true,
    "description" : "kafka test case with acks",
    "labels" : ["stage-local", "department-mydepartment", "function-myfunction"],    
    "injections" : [
     {     
        "injectid": "inject-kafka-1",
        "cron" : [],
        "active" : true,
        "service" : {
            "type": "kafka",
            "connectstring": "host.testcontainers.internal:9092",
            "username": "",
            "password": "",
            "custom": [
               {
                  "key": "topic",
                  "value": "mytopic1"
               },
               {
                  "key": "header",
                  "value": "source_kafka_headers_1.json"
               },
               {
                  "key": "senddelay",
                  "value": "15000"
               },
               {
                  "key": "acks",
                  "value": "1"
               }
            ]
         },        
        "sourcefile" : "source_kafka_1.txt",        
        "timetolive": "1m",
        "checks" : [ "check-kafka-1" ],
        "replacements" : [
         {
            "key": "#replaceme1#",
            "value": [
               {
                  "order": 1,
                  "type": "list",
                  "value": "rep11|rep12|rep13"
               }
            ]
          },
          {
             "key": "#replaceme2#",
             "value": [
                {
                   "order": 1,
                   "type": "list",
                   "value": "rep21|rep22|rep23|rep24"
                },
                {
                   "order": 2,
                   "type": "now",
                   "value": "Q"
                }
             ],
             "maxlength": 10
           },
           {
             "key": "#replaceme3#",
             "value": [
                {
                   "order": 1,
                   "type": "regex",
                   "value": "[0-9a-f]{8}-[0-9a-f]{4}-[0-9a-f]{4}-[0-9a-f]{4}-[0-9a-f]{12}"
                }
             ]
           }  
       ]
     }
    ],
    "checks": [
    {   
        "checkid" : "check-kafka-1",  
        "active" : true,
        "service" : {
            "type": "kafka",
            "connectstring": "host.testcontainers.internal:9092",
            "username": "",
            "password": "",
            "custom": [
               {
                  "key": "topic",
                  "value": "mytopic1"
               },
               {
                  "key": "group.id",
                  "value": "kafka_002.check-kafka-1.group"
               }
            ]
         },
         "validations": [
            {
               "order": 1,
               "request": "",
               "response": [ "check_kafka_1.txt" ],
               "type": "contains"
            }
         ],        
        "maxwaittime" : "30s",
        "mandatory" : true
     }
    ]
  }