{
    "id" : "s3_001",
    "testapi": "1.0",
    "active" : true,
    "description" : "s3 test case",
    "labels" : ["stage-local", "department-mydepartment", "function-myfunction"],    
    "injections" : [
     {
         "injectid": "inject-s3-1",
         "cron" : [],
         "active" : true,
         "service" : {
            "type": "s3",
            "connectstring": "host.testcontainers.internal:29000",
            "username": "admin",
            "password": "secret",
            "custom": [
             {
                "key": "region",
                "value": "eu-central-1"
             },
             {
                "key": "bucketName",
                "value": "mybucket"
             },
             {
                "key": "fileName",
                "value": "myfile-#RANDOMVALUE#.json"
             }
            ]
        },           
         "sourcefile" : "s3_file.json",
         "timetolive": "1m",
         "checks" : [ "check-s3-1" ],
         "replacements" : [
          {
            "key": "#RANDOMVALUE#",
            "value": [
              {
                "order": 1,
                "type": "list",
                "value": "a|b|c"
              }
            ]
          }
        ]
      }
    ],
    "checks": [
     {   
        "checkid" : "check-s3-1",  
        "active" : true,
        "service" : {
          "type": "s3",
          "connectstring": "host.testcontainers.internal:29000",
          "username": "admin",
          "password": "secret",
          "custom": [
            {
              "key": "region",
              "value": "eu-central-1"
           },
           {
              "key": "bucketName",
              "value": "mybucket"
           },
           {
              "key": "fileName",
              "value": "myfile-#RANDOMVALUE#.json"
           }
          ]
        },
        "validations": [
          {
              "order": 1,
              "request": "",
              "response": [ "s3_file.json" ],
              "type": "equals"
          }
        ],          
        "maxwaittime" : "10s",
        "mandatory" : true,
        "injects" : [ ],
        "checks" : [ ],
        "result2random" : [ "test2" ]
     }
    ]
  }
