{
    "id" : "jsonschema_001",
    "testapi": "1.1",
    "active" : true,
    "description" : "jsonschema test case",
    "labels" : ["stage-local", "department-mydepartment", "function-myfunction"],    
    "injections" : [
      {
          "injectid": "inject-rest-1",
          "cron" : [],
          "active" : true,
          "service" : {
             "type": "rest",
             "connectstring": "http://host.testcontainers.internal:50000/dummy/post",
             "username": "",
             "password": "",
             "custom": [
               {
                 "key": "type",
                 "value": "POST"
               },
               {
                 "key": "header",
                 "value": "source_rest_headers_1.json"
               }
             ]
         },           
          "sourcefile" : "source_rest_1.json",
          "timetolive": "1m",
          "checks" : [ "check-rest-1" ]
       }
     ],
     "checks": [
      {   
         "checkid" : "check-rest-1",  
         "active" : true,
         "service" : {
           "type": "rest",
           "connectstring": "http://host.testcontainers.internal:50000/dummy/get",
           "username": "",
           "password": "",
           "custom": [
             {
               "key": "type",
               "value": "GET"
             },
             {
               "key": "header",
               "value": "check_rest_headers_1.json"
             }
           ]
         },
         "validations": [
           {
               "order": 1,
               "request": "",
               "__comment": "check structure of the response",
               "response": [ "check_rest_1.json" ],
               "type": "jsonschema"
           },
           {
               "order": 2,
               "request": "",
               "__comment": "check content of the response",
               "response": [ "check_rest_2.json" ],
               "type": "regex"
           }
         ],          
         "maxwaittime" : "10s",
         "mandatory" : true
      }
     ]
   }