{
    "id" : "cassandra_001",
    "testapi": "1.0",
    "active" : true,
    "description" : "cassandra test case",
    "labels" : ["stage-local", "department-mydepartment", "function-myfunction"],    
    "injections" : [
     {
        "injectid": "inject-cassandra-1",        
        "cron" : [],
        "active" : true,
        "service" : {
            "type": "cassandra",
            "connectstring": "host.testcontainers.internal:9042",
            "username": "e2etest",
            "password": "e2etest",
            "custom": [
               {
                  "key": "datacenter",
                  "value": "datacenter1"
               }
            ]
         },      
        "sourcefile" : "source_cassandra_1.cql",
        "timetolive": "1m",
        "checks" : [ "check-cassandra-1", "check-to-fail-cassandra-2" ],
        "replacements" : [
         {
            "key": "#replaceme1#",
            "value": [
               {
                  "order": 1,
                  "type": "list",
                  "value": "rep11|rep12|rep13"
               }
            ]
          },
          {
             "key": "#replaceme2#",
             "value": [
                {
                   "order": 1,
                   "type": "list",
                   "value": "rep21|rep22|rep23|rep24"
                },
                {
                   "order": 2,
                   "type": "now",
                   "value": "Q"
                }
             ],
             "maxlength": 10
           },
           {
             "key": "#replaceme3#",
             "value": [
                {
                   "order": 3,
                   "type": "regex",
                   "value": "[0-9a-f]{8}-[0-9a-f]{4}-[0-9a-f]{4}-[0-9a-f]{4}-[0-9a-f]{12}"
                }
             ]
           }  
       ]
     }
    ],
    "checks": [
     {     
        "checkid" : "check-cassandra-1",
        "active" : true,
        "service" : {
            "type": "cassandra",
            "connectstring": "host.testcontainers.internal:9042",
            "username": "e2etest",
            "password": "e2etest",
            "custom": [
               {
                  "key": "datacenter",
                  "value": "datacenter1"
               }
            ]
         },
         "validations": [
            {
               "order": 1,
               "request": "check_cassandra_param_1.cql",
               "response": [ "check_cassandra_1.json" ],
               "type": "equals"
            }
         ],
        "maxwaittime" : "10s",
        "intervall" : "5s",
        "mandatory" : true
     }, {   
        "checkid" : "check-to-fail-cassandra-2",  
        "active" : true,
        "service" : {
            "type": "cassandra",
            "connectstring": "host.testcontainers.internal:9042",
            "username": "e2etest",
            "password": "e2etest",
            "custom": [
               {
                  "key": "datacenter",
                  "value": "datacenter1"
               }
            ]
         },
         "validations": [
            {
               "order": 1,
               "request": "check_cassandra_param_2.cql",
               "response": [ "check_cassandra_2.json" ],
               "type": "equals"
            }
         ],
        "maxwaittime" : "10s",
        "intervall" : "5s",
        "mandatory" : false
     }
    ]
  }